{
  "artifact_type": "seed-partitions",
  "schema_version": "1.0.0",
  "run": {
    "id": "cartpole-proof-20260711t120000z-a1b2c3d4e5f6",
    "uuid": "018f1a56-3779-7701-93ef-fa1398226d17",
    "created_at": "2026-07-11T12:00:00Z",
    "directory": "runs/cartpole-dqn/cartpole-proof-20260711t120000z-a1b2c3d4e5f6",
    "collision_policy": "reject-existing",
    "prior_run_uuid": null
  },
  "root_seed": "42",
  "derivation": {
    "algorithm": "splitmix64",
    "version": "1",
    "domain_separator": "bevy-gym/training-artifacts/v1"
  },
  "partitions": {
    "model_initialization": "12641795146655704716",
    "environment_construction": "17901056180257244794",
    "environment_resets": {
      "base_seed": "15153911699854665825",
      "per_environment": [
        {
          "environment_id": 0,
          "seed": "1000"
        },
        {
          "environment_id": 1,
          "seed": "1001"
        }
      ]
    },
    "action_exploration": "12566617844414001003",
    "replay_rollout_sampling": "13125022486215035718",
    "validation": {
      "id": "cartpole-validation-v1",
      "split": "validation",
      "sha256": "aaaaaaaaaaaaaaaaaaaaaaaaaaaaaaaaaaaaaaaaaaaaaaaaaaaaaaaaaaaaaaaa",
      "seeds": [
        "2000",
        "2001",
        "2002"
      ]
    },
    "test": {
      "id": "cartpole-test-v1",
      "split": "test",
      "sha256": "bbbbbbbbbbbbbbbbbbbbbbbbbbbbbbbbbbbbbbbbbbbbbbbbbbbbbbbbbbbbbbbb",
      "seeds": [
        "3000",
        "3001",
        "3002"
      ]
    },
    "demo": {
      "id": "cartpole-demo-v1",
      "split": "demo",
      "sha256": "cccccccccccccccccccccccccccccccccccccccccccccccccccccccccccccccc",
      "seeds": [
        "4000",
        "4001"
      ]
    }
  },
  "validation_test_separation": {
    "method": "independent-domain-separated-derivation",
    "validation_label": "validation-v1",
    "test_label": "test-v1",
    "validation_sha256": "aaaaaaaaaaaaaaaaaaaaaaaaaaaaaaaaaaaaaaaaaaaaaaaaaaaaaaaaaaaaaaaa",
    "test_sha256": "bbbbbbbbbbbbbbbbbbbbbbbbbbbbbbbbbbbbbbbbbbbbbbbbbbbbbbbbbbbbbbbb",
    "overlap_count": 0,
    "disjoint": true
  },
  "application_status": {
    "model_initialization": true,
    "environment_construction": true,
    "environment_resets": true,
    "action_exploration": true,
    "replay_rollout_sampling": true,
    "validation": true,
    "test": true,
    "demo": true
  }
}
